{
  "version": 1,
  "model": "positions_outlive_workers",
  "as_of": "2026-09-19",
  "employees": [
    {
      "employee_id": "bot-engmgr-0001",
      "display_name": "Engineering Manager / Organizer #1",
      "worker_type": "ai_bot",
      "position_id": "engineering-manager",
      "logical_role": "engineering-manager",
      "status": "active",
      "hired_on": "2026-09-19",
      "generation": 1,
      "manager_ref": "owner",
      "provider_kind": "grok-bot",
      "deployment_status": "not_yet_reconciled",
      "record_path": "workforce/people/bot-engmgr-0001/profile.yaml",
      "deployment_ref": null,
      "deployed_fingerprint": null
    },
    {
      "employee_id": "bot-product-0001",
      "display_name": "Product #1",
      "worker_type": "ai_bot",
      "position_id": "product",
      "logical_role": "product",
      "status": "active",
      "hired_on": "2026-09-19",
      "generation": 1,
      "manager_ref": "bot-engmgr-0001",
      "provider_kind": "grok-bot",
      "deployment_status": "not_yet_reconciled",
      "record_path": "workforce/people/bot-product-0001/profile.yaml",
      "deployment_ref": null,
      "deployed_fingerprint": null
    },
    {
      "employee_id": "bot-rnd-0001",
      "display_name": "R&D #1",
      "worker_type": "ai_bot",
      "position_id": "rnd",
      "logical_role": "rnd",
      "status": "active",
      "hired_on": "2026-09-19",
      "generation": 1,
      "manager_ref": "bot-engmgr-0001",
      "provider_kind": "grok-bot",
      "deployment_status": "not_yet_reconciled",
      "record_path": "workforce/people/bot-rnd-0001/profile.yaml",
      "deployment_ref": null,
      "deployed_fingerprint": null
    },
    {
      "employee_id": "bot-devlead-0001",
      "display_name": "Dev Lead #1",
      "worker_type": "ai_bot",
      "position_id": "dev-lead",
      "logical_role": "dev-lead",
      "status": "active",
      "hired_on": "2026-09-19",
      "generation": 1,
      "manager_ref": "bot-engmgr-0001",
      "provider_kind": "grok-bot",
      "deployment_status": "not_yet_reconciled",
      "record_path": "workforce/people/bot-devlead-0001/profile.yaml",
      "deployment_ref": null,
      "deployed_fingerprint": null
    },
    {
      "employee_id": "bot-assurance-0001",
      "display_name": "Assurance #1",
      "worker_type": "ai_bot",
      "position_id": "assurance",
      "logical_role": "qa+security",
      "status": "active",
      "hired_on": "2026-09-19",
      "generation": 1,
      "manager_ref": "bot-engmgr-0001",
      "provider_kind": "grok-bot",
      "deployment_status": "not_yet_reconciled",
      "record_path": "workforce/people/bot-assurance-0001/profile.yaml",
      "deployment_ref": null,
      "deployed_fingerprint": null
    },
    {
      "employee_id": "bot-auditor-0001",
      "display_name": "Independent Auditor #1",
      "worker_type": "ai_bot",
      "position_id": "auditor",
      "logical_role": "auditor",
      "status": "active",
      "hired_on": "2026-09-19",
      "generation": 1,
      "manager_ref": "owner",
      "provider_kind": "grok-bot",
      "deployment_status": "not_yet_reconciled",
      "record_path": "workforce/people/bot-auditor-0001/profile.yaml",
      "deployment_ref": null,
      "deployed_fingerprint": null
    }
  ]
}
